{
  "$schema": "http://json-schema.org/draft-07/schema#",
  "$id": "https://agentscrape.local/schemas/validation-report.schema.json",
  "title": "ValidationReport",
  "type": "object",
  "additionalProperties": false,
  "properties": {
    "reportId": {
      "type": "string",
      "minLength": 1
    },
    "scope": {
      "type": "object",
      "additionalProperties": false,
      "properties": {
        "repo": {
          "type": "string",
          "minLength": 1
        },
        "stage": {
          "type": "string",
          "minLength": 1
        },
        "target": {
          "type": "string",
          "minLength": 1
        }
      },
      "required": [
        "repo",
        "stage",
        "target"
      ]
    },
    "generatedAt": {
      "type": "string",
      "format": "date-time"
    },
    "summary": {
      "type": "object",
      "additionalProperties": false,
      "properties": {
        "overallStatus": {
          "type": "string",
          "enum": [
            "pass",
            "warn",
            "fail"
          ]
        },
        "totalChecks": {
          "type": "integer",
          "minimum": 0
        },
        "passed": {
          "type": "integer",
          "minimum": 0
        },
        "warned": {
          "type": "integer",
          "minimum": 0
        },
        "failed": {
          "type": "integer",
          "minimum": 0
        }
      },
      "required": [
        "overallStatus",
        "totalChecks",
        "passed",
        "warned",
        "failed"
      ]
    },
    "checks": {
      "type": "array",
      "minItems": 1,
      "items": {
        "type": "object",
        "additionalProperties": false,
        "properties": {
          "checkId": {
            "type": "string",
            "minLength": 1
          },
          "layer": {
            "type": "string",
            "enum": [
              "schema-validation",
              "example-validation",
              "cross-artifact-consistency",
              "template-alignment",
              "skill-registry-integrity",
              "skill-frontmatter-integrity",
              "install-plan-sanity"
            ]
          },
          "status": {
            "type": "string",
            "enum": [
              "pass",
              "warn",
              "fail"
            ]
          },
          "summary": {
            "type": "string",
            "minLength": 1
          },
          "refs": {
            "type": "array",
            "items": {
              "type": "string",
              "minLength": 1
            }
          }
        },
        "required": [
          "checkId",
          "layer",
          "status",
          "summary"
        ]
      }
    },
    "blockingIssues": {
      "type": "array",
      "items": {
        "type": "string",
        "minLength": 1
      }
    },
    "warnings": {
      "type": "array",
      "items": {
        "type": "string",
        "minLength": 1
      }
    },
    "assumptions": {
      "type": "array",
      "items": {
        "type": "string",
        "minLength": 1
      }
    }
  },
  "required": [
    "reportId",
    "scope",
    "generatedAt",
    "summary",
    "checks",
    "blockingIssues",
    "warnings"
  ]
}
